user_id,meeting_response_id,issue,priority,resolves_flag,recognize_performance_flag,teacher_support_flag,leader_support_flag,advance_equality_flag,others_flag
31,139,Throughout south later apply your story response.,24,True,False,False,True,True,Low
22,124,However light set well camera still.,11,True,False,True,True,True,Low
18,180,Avoid father participant message.,23,False,True,True,True,False,Top
28,183,Treat structure seat happy receive nation.,12,False,False,False,False,False,Top
10,94,Movie baby half leg look whether stuff.,12,True,True,True,False,False,Low
95,207,Prepare receive information effect wish ready.,14,False,True,False,True,False,Low
97,139,When that within community plant.,16,False,True,True,True,False,Top
68,74,Else director whose choice poor.,24,True,True,False,False,True,Top
35,47,Sea physical evidence would.,8,False,False,True,False,False,Medium
21,103,Door industry choice seem daughter choose.,2,False,False,True,True,False,Medium
82,200,Dark keep small seem step recently.,8,False,True,True,True,True,Low
64,101,Rock exist wish store defense production.,9,False,False,False,True,False,Medium
38,109,Hear let again rich.,6,True,True,False,True,False,Low
25,208,Work environment from nor safe ahead.,25,False,False,True,False,True,Top
12,155,Culture again recently.,17,True,True,False,True,True,Top
51,86,So stuff than per force big huge.,24,True,True,False,True,True,Low
49,191,Study look movie.,4,True,True,False,False,True,Low
12,83,Hospital none hard part support television.,20,False,False,False,True,False,Low
36,82,Green strategy so less explain those.,21,True,False,True,True,True,Top
74,11,Game back leave way fight improve wind.,13,False,True,False,True,True,Low
33,64,Concern memory include high national individual small.,18,True,False,False,True,True,Low
87,85,Anything it term summer data strong.,23,True,False,False,True,False,Low
63,99,Machine senior family.,1,False,True,False,True,False,Low
59,53,Attorney activity president collection game structure hair good.,8,True,False,True,False,True,Low
43,216,Already entire how article evening method theory.,7,True,True,False,False,False,Medium
24,40,Study worker risk brother trip pay agency religious.,24,False,True,True,True,False,Top
14,135,Reach issue build per arrive.,18,False,False,False,False,False,Top
60,144,Husband protect director.,21,False,True,False,False,True,Top
49,151,Prevent few close process light standard.,15,False,False,False,True,False,Top
40,177,Benefit consumer charge yet mission budget.,22,True,False,True,True,False,Medium
42,168,Sit amount general.,19,True,True,False,True,True,Low
54,1,Type soon girl discuss public group early foreign.,25,True,True,False,True,True,Top
50,145,White ok scene property role also seat possible.,2,True,True,True,False,True,Low
89,57,Space fly house response social.,10,False,False,True,True,True,Medium
63,22,Full small play dog.,21,False,True,True,False,False,Medium
79,69,Fear mission year wife media father.,12,False,True,True,True,True,Top
16,146,Good play ball interesting walk federal college century.,20,False,True,False,False,True,Top
36,40,Prepare full hospital sister.,13,True,True,True,False,True,Low
72,139,Loss summer attorney hotel.,14,True,False,False,True,False,Low
74,214,What which hit understand wonder.,2,True,True,False,True,False,Top
79,5,Unit heavy weight teach.,21,False,True,False,False,False,Top
17,150,Line analysis bill policy early.,7,True,True,True,True,True,Top
39,20,Now south base also.,4,True,False,True,True,False,Top
65,133,Line will heavy drug chair.,7,True,False,False,False,False,Low
91,16,Wonder personal bag skin executive from.,18,False,False,False,False,True,Top
39,40,Act major hot until hotel investment.,25,True,True,False,True,False,Top
57,44,Set something beautiful participant both education I.,11,True,True,False,False,True,Medium
68,96,Society dog certainly increase camera break wife.,8,True,True,True,True,True,Top
33,169,Operation ok similar law fine.,23,True,False,False,True,True,Top
83,1,Region admit pull end.,10,False,False,True,False,True,Low
24,172,Kid institution cut line doctor for process.,7,True,True,True,False,True,Low
2,68,Other later almost my.,16,True,False,False,False,False,Low
70,156,According bar factor friend building culture.,7,False,True,True,False,False,Top
42,45,Four left hospital eat news through really.,4,True,True,False,True,True,Medium
90,137,Yet despite decision.,25,True,False,False,False,False,Top
63,30,Memory company together area risk miss kind require.,1,True,False,False,False,True,Medium
60,4,Recent watch wish always.,10,False,False,True,True,True,Top
7,86,Plant age upon campaign commercial line after.,16,False,True,True,False,False,Low
68,139,Health reflect me current government concern.,20,False,True,False,True,True,Top
45,73,Teach assume successful brother time sell pass daughter.,20,True,False,False,True,True,Medium
96,178,Ready best prepare score great short.,14,False,False,False,True,False,Medium
55,184,Song authority always public although.,6,True,True,True,False,False,Top
83,92,Clear clear turn always feeling hold themselves.,18,True,False,False,False,False,Medium
21,7,Woman house security.,2,False,False,True,True,True,Medium
19,7,House hundred professor spring look.,2,True,False,False,False,False,Top
72,206,Short maybe exist must mouth statement.,23,False,True,True,True,True,Low
36,178,Mouth early gun degree.,15,False,True,False,True,False,Top
100,185,Make model environmental car meet.,12,False,False,True,True,False,Medium
44,143,Run daughter like form society.,6,True,True,True,False,False,Low
58,28,Human couple business nation list specific sign.,12,True,True,False,False,True,Medium
26,45,From report reveal fish somebody wall about.,2,True,True,False,True,True,Top
37,18,Nature turn part body write indeed.,4,False,False,True,True,True,Low
16,145,Citizen street lawyer should push event.,25,True,True,True,False,True,Medium
53,167,Guy radio him near Republican.,17,False,True,False,True,True,Low
49,43,Happy loss new stand.,3,False,True,False,False,False,Top
73,28,Race such continue treatment need kind too process.,4,False,True,True,False,True,Medium
69,187,Us anyone that word try stop painting future.,23,False,True,True,True,True,Top
97,94,Up occur student series have also recent.,11,False,False,True,False,False,Top
81,202,Discover base allow population get the.,22,True,True,True,True,True,Medium
16,69,Need paper stock.,19,True,False,False,True,False,Low
29,149,Final appear including what nothing instead item on.,18,False,False,False,False,True,Low
60,116,Nature church onto trial watch total laugh.,12,False,True,False,True,False,Low
2,219,Station Mr tax now sport message.,8,True,True,True,True,True,Medium
23,3,Agree space focus girl many vote set.,1,True,True,False,False,True,Medium
54,75,Glass finally great accept test physical.,24,True,False,False,True,True,Medium
84,85,Consumer road including but think board.,10,True,False,True,True,False,Top
82,176,Democratic shake pass great arm however item.,24,False,True,False,True,False,Low
34,89,Not such measure wall music manage.,22,False,True,False,True,True,Top
52,68,Once fast responsibility for notice our mother.,2,True,True,True,True,False,Top
57,210,Throw party whether most claim.,10,True,False,False,False,False,Top
62,151,Hotel hand store.,9,False,True,True,True,True,Low
2,112,Sell too third each these that.,20,False,True,False,False,False,Low
56,220,Their oil next must close college high.,25,True,False,True,False,False,Low
85,198,Approach go miss year.,17,False,True,True,False,True,Low
4,14,Three article fight fish.,17,True,True,False,False,True,Low
69,111,Stay treatment heavy tend suddenly figure.,23,False,False,False,False,True,Top
16,30,Page store yourself money social whatever nice.,12,False,True,True,True,True,Top
13,165,Human five imagine play.,15,False,False,False,True,True,Medium
53,44,Today ground building cover rate since.,2,False,False,True,True,False,Top
47,39,Little treatment own require poor.,1,False,False,True,False,False,Low
72,125,Leader green make this.,15,False,False,True,True,True,Low
4,208,See culture other teacher range up.,21,True,False,False,True,True,Low
49,175,Claim some table benefit inside employee.,16,False,True,True,True,True,Medium
65,97,Family others total source lay project represent.,13,False,False,True,True,False,Low
40,108,Cause glass born individual policy research.,2,False,True,False,False,False,Top
12,7,Modern capital exactly western attack ready.,12,True,False,True,True,False,Low
26,89,Whatever attack gas property.,17,False,False,True,True,False,Top
66,178,Me fight friend sense.,25,True,True,False,False,False,Top
17,33,Situation middle often girl cultural.,16,False,False,False,True,True,Medium
38,128,Walk sell perhaps movement candidate although.,18,False,False,True,True,False,Medium
99,45,Affect last expect heavy speech rule treatment.,20,True,False,True,False,True,Medium
35,100,Approach hour high consider author wife way.,10,False,False,False,False,False,Low
99,187,Mr history end outside why TV.,6,True,True,True,False,False,Top
10,20,Concern stuff behavior involve when to nature.,23,False,True,False,False,False,Medium
16,57,Go citizen generation final each third.,5,False,True,False,False,True,Medium
41,36,Paper better real meeting.,1,False,False,True,True,True,Low
14,112,Region trip authority.,22,True,False,True,True,False,Top
