user_id,meeting_response_id,description,due_date,status
43,29,Thing anyone nice challenge.,2023-07-09,Completed
79,64,Participant probably last reality fly.,2023-06-28,Not Started
69,84,Ground response matter production stand energy own.,2023-07-11,On Going
57,186,Expert glass around local outside sort chair.,2023-07-06,On Going
79,151,Respond clearly including door.,2023-06-17,Not Started
81,53,Might hour mission land table.,2023-06-23,On Going
13,26,Whatever lawyer air pass office.,2023-06-20,On Going
82,159,Grow science realize improve.,2023-06-22,On Going
1,79,Lose sell watch way occur.,2023-07-05,On Going
3,157,Special spring clear money whether.,2023-07-04,On Going
50,36,Hotel figure ok measure.,2023-06-26,On Going
56,24,Right outside shake.,2023-07-11,Completed
53,55,Statement draw deep similar political include report.,2023-07-08,Completed
16,147,Mind other season building responsibility marriage because.,2023-06-29,On Going
63,67,Deep avoid under raise although later.,2023-07-10,Not Started
53,139,Evening us quality statement mean method.,2023-07-06,Not Started
88,152,Crime because process old kid so high.,2023-06-17,Completed
84,90,Benefit available knowledge little.,2023-06-22,Not Started
95,214,Cover word similar high their.,2023-07-10,Completed
81,144,General mouth nation author up save.,2023-07-13,Not Started
52,76,Other fear leg clearly still something.,2023-06-27,On Going
79,184,Collection learn little three.,2023-07-13,On Going
53,51,Pay officer leave serious affect.,2023-07-04,Completed
49,16,Score appear manage hospital thousand admit.,2023-06-30,Completed
48,80,Travel animal drop no.,2023-07-06,On Going
34,69,Billion owner from pattern.,2023-07-07,On Going
87,200,Action last collection control mouth large life.,2023-06-28,Not Started
32,143,Top cultural fall source.,2023-07-10,On Going
36,113,Story work we type.,2023-07-13,Completed
4,10,Finish allow south sit.,2023-07-07,Not Started
95,48,True stuff success identify.,2023-06-24,Completed
40,76,Grow image compare industry decade.,2023-07-02,On Going
53,109,Effort rate listen police early car financial admit.,2023-07-03,Not Started
89,24,Thing ground skin girl matter.,2023-07-07,Completed
90,13,Field campaign short.,2023-07-02,Completed
24,217,Economy feel why vote.,2023-07-01,Completed
52,185,Indicate or leg degree attack party.,2023-07-13,Not Started
67,52,By operation reason some beyond like heavy.,2023-07-08,Completed
15,137,Thought include already commercial Congress what.,2023-07-12,Not Started
88,210,Role fly serious economic school nation send.,2023-06-25,On Going
54,178,Large bring simply section.,2023-06-27,Completed
19,151,Hear president tell skill.,2023-07-02,Not Started
31,162,Couple eight before lay toward let his participant.,2023-07-06,Completed
30,204,Look fear more.,2023-07-05,On Going
49,29,Hard color my skill book city shake.,2023-07-10,Completed
12,133,Throughout company cause natural generation.,2023-06-26,On Going
64,94,Film activity water especially yard power.,2023-06-16,Completed
2,139,Health move gun trade daughter join.,2023-06-17,Completed
76,165,Major unit reality plan.,2023-06-30,Not Started
1,90,Age thing cold long.,2023-07-07,Not Started
12,165,I tax sign go until environment film.,2023-07-12,Completed
23,31,On also region three maintain with.,2023-07-10,Not Started
19,119,Number customer international develop air.,2023-06-22,Not Started
4,17,Question most without individual.,2023-07-01,Not Started
56,2,Southern upon trip improve Democrat against.,2023-06-30,Not Started
1,130,Figure others education modern minute attention easy.,2023-07-09,Not Started
60,222,Own lead security computer window.,2023-06-16,On Going
39,109,Physical close body camera rock.,2023-06-19,Completed
27,76,Them when cultural save say reason.,2023-07-10,Not Started
87,25,These process scientist say.,2023-06-22,Not Started
49,47,Real someone case certain front.,2023-06-17,Completed
54,214,Cup paper several woman happy arm.,2023-06-17,Not Started
42,87,Spring early stop travel because.,2023-07-10,Not Started
69,24,Job television young account college because international.,2023-07-07,On Going
87,206,Whom give brother option all.,2023-07-14,Completed
89,8,Go manage phone.,2023-06-21,Completed
58,210,Attack my authority admit line human.,2023-07-04,Not Started
19,173,Decide early start.,2023-06-21,Not Started
23,39,Final either firm generation magazine business.,2023-06-16,Not Started
97,206,Positive probably ten leader set ahead customer sing.,2023-07-03,Not Started
88,162,Economy stock whom industry nation marriage despite feel.,2023-06-30,On Going
50,136,Safe growth lay program type.,2023-07-09,Completed
38,200,Lawyer employee energy avoid piece history.,2023-07-07,On Going
27,38,Blood near parent over.,2023-07-11,Completed
43,19,Lay girl today send heavy person.,2023-07-11,Completed
34,152,Understand eight home moment huge throughout.,2023-07-06,Completed
46,169,None game whatever many wonder certainly hand him.,2023-07-14,On Going
4,206,Game our cup.,2023-07-05,Not Started
22,26,Benefit production win although movement.,2023-06-16,On Going
42,26,Structure around news offer job hand.,2023-07-12,On Going
15,68,Against music law trial line behavior hotel successful.,2023-06-20,Completed
69,200,Level exactly anyone truth.,2023-06-22,Completed
77,217,Job voice season.,2023-06-17,Not Started
28,132,Nor key Congress senior.,2023-06-18,Completed
16,163,Blood for again cup bed dark job get.,2023-07-03,On Going
44,49,Purpose school owner fill level up set.,2023-06-29,On Going
57,35,Sister our short deep impact gas local.,2023-06-26,On Going
2,150,That onto population how activity catch book.,2023-07-03,Completed
60,85,Under read edge various receive enjoy college.,2023-06-21,Not Started
28,170,Return drug blood know task.,2023-06-25,Completed
56,136,Movement meeting interesting.,2023-07-03,Not Started
55,217,Son Republican material hold four number majority.,2023-07-06,Completed
99,216,Develop cut car everything bit heart.,2023-06-18,On Going
41,93,True analysis write pretty common institution fund.,2023-07-11,On Going
42,213,Media participant early free.,2023-06-27,Completed
85,168,Benefit really crime weight dinner center ten together.,2023-06-19,On Going
53,150,Case role television star field home against.,2023-06-20,Completed
38,52,Teacher image none community physical do story.,2023-06-18,On Going
1,157,Child tell other them music seven.,2023-07-10,On Going
2,30,Brother management themselves take American.,2023-07-07,Completed
46,9,Town small off direction voice.,2023-07-03,On Going
57,221,Economy lay option capital between.,2023-07-07,On Going
76,4,Apply continue reality day.,2023-06-25,Not Started
73,60,Local read little yard sing laugh language.,2023-06-30,Not Started
9,189,Fly community concern miss middle picture get.,2023-07-10,Not Started
45,90,Low far fear skill cup.,2023-06-27,Not Started
43,38,Walk lot firm place.,2023-07-11,Completed
81,115,Build stop central community require mission.,2023-06-16,On Going
43,96,Customer every black gas military piece.,2023-07-02,Not Started
32,65,Pm western early firm add.,2023-07-01,Not Started
41,158,Turn food imagine wait.,2023-06-24,On Going
26,125,I business prepare public deep.,2023-06-27,Not Started
11,167,Form budget someone fill those.,2023-06-16,Not Started
91,202,Process trial their too lot simply.,2023-07-03,Completed
38,160,Wrong chair message agency where fire director court.,2023-07-04,Completed
93,121,Significant better deal second task during.,2023-06-23,On Going
48,219,Painting enough everyone.,2023-07-05,Completed
18,97,Create off road not book.,2023-07-03,Completed
22,96,Approach away group least civil focus.,2023-07-01,On Going
32,172,Resource key away fact clearly and.,2023-07-10,On Going
55,117,Painting phone role shoulder carry talk.,2023-07-03,Not Started
91,89,Be up police near matter.,2023-06-23,Not Started
3,15,Really budget recently skill show.,2023-06-26,On Going
8,87,Increase training matter night.,2023-06-23,Completed
85,190,Police move can catch dream.,2023-06-17,On Going
48,86,Long whether culture from perform different.,2023-07-10,Not Started
44,115,Here new large but.,2023-07-06,Completed
35,88,Enough age election person may prepare miss through.,2023-07-11,Completed
56,179,During assume less describe southern quite.,2023-07-10,Completed
5,139,Wonder turn should despite cover.,2023-06-16,Not Started
85,147,Nor member choice water.,2023-07-04,Not Started
94,46,Create film address quickly run later one ability.,2023-07-02,Not Started
98,185,Hair health might major.,2023-07-09,On Going
77,143,To leg even officer food.,2023-06-21,Completed
55,212,Blood interesting have operation.,2023-07-02,On Going
37,126,As line policy model guy person maintain.,2023-06-20,On Going
87,214,Shoulder good property factor.,2023-07-13,Completed
38,214,Visit kind system customer.,2023-06-30,On Going
93,5,Common together hold training west.,2023-07-05,On Going
17,74,Issue still girl.,2023-06-28,Not Started
97,140,Want few very a wind heart establish.,2023-06-23,Completed
16,125,Officer various we create add recently open skin.,2023-07-12,Completed
31,177,Sure discuss evidence wait than scientist event.,2023-06-27,On Going
11,58,Recent suffer job team order power.,2023-07-03,Not Started
39,72,He middle space wind throughout.,2023-07-12,Not Started
44,98,Side pressure base staff go policy media sense.,2023-07-10,On Going
73,47,Us alone involve pick certainly scientist.,2023-07-07,Completed
60,6,Computer character tonight education.,2023-06-22,Not Started
29,114,Lead look give significant meet.,2023-07-11,On Going
66,1,Rock chance economic.,2023-07-05,Completed
84,196,First benefit trial young find contain represent organization.,2023-06-17,Not Started
88,156,Drug protect series.,2023-07-13,Not Started
75,60,Mother result science environment see attorney finally.,2023-07-12,On Going
72,35,Position could admit what minute data.,2023-07-12,Completed
17,106,City story game between successful they.,2023-06-24,On Going
88,107,Three maybe though heavy.,2023-06-23,On Going
22,171,Knowledge let various way name author.,2023-07-09,Completed
19,15,Develop fly sister cover.,2023-06-21,Not Started
66,72,Mother size happen yard animal.,2023-07-07,Completed
31,63,View remain ball rate main site would.,2023-06-25,On Going
98,51,Who hotel thought explain expert before wait.,2023-06-17,Completed
85,84,Low speech figure general by.,2023-07-13,On Going
82,214,Out name successful per lawyer different compare former.,2023-06-21,Completed
28,198,Somebody box drug need word mention animal project.,2023-06-20,Not Started
97,223,Century catch necessary threat support.,2023-06-21,Completed
45,101,Garden too sense.,2023-07-08,On Going
100,68,Measure expect until performance.,2023-06-26,Completed
62,84,Much if enjoy during its want.,2023-06-18,Not Started
11,192,Computer here without program.,2023-06-25,Completed
9,182,Story citizen adult.,2023-06-22,Completed
27,157,Middle right design central lawyer family myself.,2023-06-18,Completed
85,26,One bit herself whose sometimes.,2023-07-11,On Going
12,105,Among half clear family power onto.,2023-06-18,Not Started
90,174,Course become its effort.,2023-06-25,On Going
39,82,Foreign stock tend authority.,2023-06-16,Completed
18,81,Around great political record green eye part.,2023-07-13,Completed
62,92,Into market town program read line issue eat.,2023-07-11,Not Started
60,161,Adult brother position pick thing.,2023-07-02,Completed
23,84,Same study leave film.,2023-07-08,On Going
18,81,Woman prepare perform wonder lead ahead.,2023-06-16,Completed
94,202,Now nor bar clearly evening town growth.,2023-07-07,Not Started
4,175,Car part wide college form thing by action.,2023-06-27,On Going
48,152,Candidate strategy produce look behavior ever hundred.,2023-07-14,On Going
92,89,Reason other teach child million.,2023-07-05,Completed
43,135,Partner usually section way participant.,2023-07-08,Not Started
11,36,Five social view however although figure.,2023-07-14,On Going
32,151,Show statement live section.,2023-07-07,Completed
4,107,Office city official subject staff first life.,2023-07-09,On Going
70,71,Power thus perhaps would kitchen you church third.,2023-07-14,On Going
6,204,Indeed other business white.,2023-06-20,Completed
23,107,Case down anything society begin little animal threat.,2023-07-11,On Going
68,67,Which grow age leg movie.,2023-06-28,Completed
48,114,Real concern pretty why field.,2023-06-17,Not Started
39,71,Down not beautiful help.,2023-07-12,Completed
45,29,Relationship its lot cell develop situation statement growth.,2023-06-27,Completed
86,139,Rule store until.,2023-07-02,Not Started
13,69,Population attorney world like assume part.,2023-06-26,Not Started
45,174,Car similar minute easy hand most pick.,2023-06-27,Not Started
67,113,Argue as former company listen.,2023-07-05,Completed
16,29,Card force outside every major.,2023-06-25,On Going
65,129,Our wife garden marriage.,2023-06-24,On Going
37,18,Place yes chance scene indeed rock seven.,2023-06-28,Completed
65,61,Provide election officer author.,2023-06-29,Not Started
79,113,Wish test heart movement good join discover.,2023-07-10,On Going
83,130,Matter suffer father.,2023-07-07,Not Started
65,170,Get force language condition.,2023-07-12,Not Started
58,25,Computer audience lose these.,2023-07-14,On Going
14,37,Have better sister resource white season light service.,2023-07-13,On Going
3,164,Step be mission candidate.,2023-06-29,Not Started
5,4,Third most company hand become recent.,2023-06-20,Completed
7,93,Feeling box be blue.,2023-06-19,On Going
50,130,Message class wait all current front live.,2023-06-21,Completed
35,67,Fund himself stand miss.,2023-07-06,On Going
99,126,Common director citizen hotel.,2023-06-20,Completed
50,3,Actually increase system offer training official.,2023-06-28,Completed
89,135,Marriage study performance.,2023-06-30,Not Started
69,142,Walk few drive matter.,2023-06-18,On Going
82,74,Develop difference social program.,2023-07-09,On Going
27,5,Toward look use war particularly street PM senior.,2023-06-26,Completed
47,136,Own difficult article onto assume.,2023-07-02,Not Started
57,36,Purpose value measure clear music.,2023-06-27,On Going
54,221,Sing risk space.,2023-06-21,On Going
46,26,Community treat room institution world class style.,2023-07-11,Not Started
62,209,Increase international reach name response person.,2023-07-14,On Going
26,25,Long state any available rather.,2023-07-04,On Going
93,146,Clearly ability create anyone leave us perhaps.,2023-07-13,Completed
29,196,Alone case career.,2023-07-13,Completed
25,157,Where financial current through difficult road.,2023-07-05,Not Started
77,40,Kitchen daughter suddenly activity art section.,2023-06-30,On Going
69,223,Yeah into song site leg range total also.,2023-07-04,On Going
7,112,Professor pattern school where listen home.,2023-06-19,Not Started
70,186,Outside follow thank ten.,2023-06-30,Completed
51,166,There value sense themselves value.,2023-07-12,Not Started
26,49,Can reach thousand section law.,2023-06-18,On Going
15,126,Still exist front get week.,2023-07-03,Completed
31,168,Bad today course form speech.,2023-07-08,Not Started
94,40,Its could bring network step.,2023-07-14,Completed
88,217,Instead trial social specific.,2023-07-06,On Going
65,68,Raise maybe her national social American half.,2023-07-01,Not Started
76,89,Dream group economic store full risk herself shoulder.,2023-07-14,Completed
21,130,Memory agreement suddenly car career prevent our.,2023-06-28,Completed
53,137,Method stay question white trade hundred particularly.,2023-06-27,Completed
29,106,Whole mother talk paper would pressure commercial.,2023-06-16,Completed
75,75,For ball attorney financial floor way total summer.,2023-07-13,Not Started
7,153,Toward represent assume body.,2023-07-12,Not Started
35,146,Everything matter really ten.,2023-06-23,Not Started
61,54,Cause situation high difficult air here impact adult.,2023-06-23,On Going
53,218,Fill old million itself individual middle recently.,2023-07-02,On Going
11,210,Decision imagine a land data quickly.,2023-06-30,Not Started
93,120,Rock side instead put window.,2023-07-08,Not Started
82,115,Bring remember policy billion.,2023-06-24,On Going
43,126,Either focus order treat recent very.,2023-06-30,Completed
77,78,Best either bank me despite apply.,2023-07-11,Completed
78,106,They wrong ok.,2023-07-10,On Going
80,174,Subject figure toward hundred six try clear hit.,2023-07-07,On Going
2,180,Ago investment focus force pattern.,2023-07-08,On Going
91,145,Section lay attorney.,2023-07-09,Completed
78,25,Local color only sister ok possible probably.,2023-07-13,Completed
60,223,Help realize herself same price perhaps.,2023-06-20,Completed
10,136,Movement training attention time street relationship sound.,2023-07-02,On Going
82,165,Need speak small attorney.,2023-06-23,On Going
85,35,Peace which live several.,2023-06-20,On Going
22,168,Board collection already mission together most head increase.,2023-07-06,On Going
28,147,Follow pass learn daughter.,2023-07-07,On Going
21,120,Standard often argue government during.,2023-07-10,Completed
44,152,Certain material family receive physical fast sea physical.,2023-07-07,On Going
74,104,Sound certain interview item deal.,2023-07-12,Completed
33,7,Others without likely thought usually industry late.,2023-07-03,Completed
71,190,Community current single or modern they find walk.,2023-07-11,On Going
93,163,Major parent wall four movement analysis.,2023-07-01,On Going
38,146,Bank price drop best their skill.,2023-06-28,On Going
95,189,His while eight.,2023-06-17,Completed
16,183,Opportunity nature heavy century face five ball.,2023-06-29,Completed
18,105,Share rock PM effect dream me.,2023-07-11,Not Started
75,108,Whom product ever treat cut against those.,2023-06-27,Not Started
89,22,Leg skin center sound fine green.,2023-06-28,Completed
48,38,Example just better bag leave art financial perform.,2023-06-21,Not Started
48,155,Main both pressure apply.,2023-07-09,On Going
86,140,Cut college keep nearly.,2023-06-18,On Going
48,197,Production prevent dinner challenge feeling leave.,2023-07-12,Completed
91,146,Exist doctor realize table.,2023-07-14,Completed
82,85,Bring central control car later often.,2023-06-21,On Going
7,156,Rich foot work have serve place hour.,2023-07-11,On Going
57,158,Name establish late religious give task.,2023-07-09,On Going
93,74,Something agreement card authority.,2023-06-17,On Going
89,12,Baby agree news customer.,2023-07-10,Completed
54,194,Happen seven system.,2023-07-11,On Going
89,167,Stand sea people.,2023-07-11,On Going
98,175,Forward bank push training film activity hot.,2023-07-01,Not Started
58,218,Drive learn crime message.,2023-07-04,Not Started
75,40,Cultural off thousand prove also through value.,2023-06-29,On Going
43,151,Place than indicate institution kind within.,2023-06-22,Not Started
77,118,Final rest leader keep police might read.,2023-07-07,Completed
79,156,Grow floor short decide window community.,2023-06-16,Not Started
69,212,Cup another tend indicate establish again civil.,2023-06-20,Not Started
17,53,Life fall of take above nearly deal.,2023-06-18,On Going
23,12,Job particularly site wait month.,2023-07-12,Completed
41,94,Responsibility movement difficult step population buy.,2023-07-06,Completed
33,175,Most ready himself animal through.,2023-07-05,Completed
8,126,Course politics finally visit new argue.,2023-06-27,Completed
66,16,After world realize include want effect.,2023-06-18,Completed
84,131,Data gun woman go which gun.,2023-07-07,Not Started
77,113,During region personal with.,2023-06-17,Completed
20,164,Mission may seem together movement best range modern.,2023-07-04,On Going
68,120,Court prove three happy hope perform address.,2023-06-17,On Going
38,116,Age drug race attack article federal fact.,2023-06-26,Completed
45,211,Hand but truth others position.,2023-06-16,Not Started
51,4,Fast suggest pick practice keep.,2023-06-25,Completed
4,149,Name Democrat put behavior report hospital.,2023-07-01,On Going
35,162,Order policy carry return compare since.,2023-07-07,Not Started
2,165,Join here expert opportunity owner under.,2023-06-27,Not Started
51,183,Quality provide quite return view.,2023-07-01,Not Started
98,90,Medical test country window accept.,2023-06-21,Not Started
78,108,Your expect fight new.,2023-06-20,Completed
76,78,Put everything write serious debate doctor.,2023-06-29,On Going
39,145,Enough entire name return.,2023-07-09,On Going
71,153,Board vote race part often event she.,2023-07-10,On Going
52,202,Reflect himself enjoy get oil.,2023-06-21,On Going
60,191,Treatment eat language.,2023-07-13,On Going
64,127,Story seven everybody cultural politics on enough.,2023-06-27,On Going
18,187,Image actually often picture life.,2023-07-10,Completed
91,163,Ground myself smile audience.,2023-07-14,On Going
97,202,Safe for prove.,2023-06-16,On Going
5,119,Song environment off concern trip.,2023-06-29,On Going
92,185,Cost listen material.,2023-06-16,On Going
89,113,Someone new second science quite.,2023-06-21,On Going
53,82,That yet represent impact economy.,2023-07-12,Not Started
55,185,Something country store surface.,2023-07-12,Not Started
90,8,Back onto mother some really seven arrive.,2023-07-01,On Going
80,16,Teach question some standard blood environmental.,2023-07-14,Not Started
89,163,Choose pattern same hit medical fact music.,2023-07-14,Not Started
94,156,Direction no politics study second Mrs.,2023-07-14,On Going
39,36,Him relationship story form before democratic majority answer.,2023-06-25,On Going
33,199,Result baby food group win.,2023-06-20,Completed
29,69,They summer performance white magazine strategy.,2023-07-14,Not Started
70,40,Movie get right to.,2023-06-26,Completed
80,143,Would most forward about.,2023-06-26,Completed
87,210,Senior against campaign production various democratic outside.,2023-07-11,Completed
26,98,Garden camera raise majority never.,2023-06-25,On Going
81,55,Condition fall price wife state leg join.,2023-07-10,Not Started
23,8,Cover each nearly.,2023-07-04,Completed
82,220,Unit try TV billion since member process.,2023-07-01,On Going
99,159,Must recognize side section help work western.,2023-07-05,Not Started
80,161,Before conference car figure learn practice.,2023-06-26,Completed
70,80,Think company listen majority particular hour common none.,2023-07-04,Completed
80,162,Oil travel short get line eye.,2023-06-24,Completed
53,129,South north head year source tax later level.,2023-07-10,Not Started
6,201,Mean environment before bad sign study reduce.,2023-06-23,Not Started
8,4,Number against material anyone education perform.,2023-06-28,Not Started
66,98,Offer indicate policy star rate president.,2023-07-02,Completed
49,147,Collection Congress man later information successful.,2023-06-21,Completed
88,154,Strong arrive have officer leg particularly million hard.,2023-07-10,Completed
8,163,Issue provide Mrs theory note address.,2023-07-09,On Going
35,83,Customer hair test appear such debate.,2023-07-06,On Going
46,80,Film standard foot throw guess price line.,2023-06-27,Not Started
11,42,Leg magazine although its Republican.,2023-06-19,Completed
97,65,Difference which nation approach.,2023-06-18,Completed
2,42,Pick ground discuss mean edge operation.,2023-07-05,On Going
4,68,Democrat practice eat every.,2023-06-26,Not Started
41,95,General career available cover authority coach.,2023-07-12,Not Started
24,122,Ever rate almost my kind.,2023-06-18,Completed
57,200,Part fact look leg need just building.,2023-06-26,Not Started
98,166,Specific either order cut up left beautiful.,2023-06-25,Not Started
76,56,Rest over toward respond history.,2023-06-29,Not Started
11,142,Trade example yard that team nice bit itself.,2023-06-20,On Going
57,17,Within cut hand foot north suffer.,2023-06-22,Completed
59,47,Argue know material pass.,2023-07-06,Completed
88,123,Debate executive modern wrong name official part.,2023-07-10,Not Started
74,140,Thank start guy high put.,2023-06-22,On Going
63,196,Million condition buy on meeting.,2023-06-22,Not Started
78,89,Increase base future start sea watch.,2023-06-28,Completed
97,70,Outside section picture account next agent statement.,2023-07-08,On Going
78,174,Action generation billion friend voice idea dog.,2023-06-19,On Going
95,134,Road me learn worker little speech inside certainly.,2023-06-22,On Going
12,140,Glass good method TV owner market year he.,2023-06-21,On Going
65,78,Week its game.,2023-06-27,On Going
24,176,Site cut reduce control hair.,2023-06-30,Completed
71,112,His necessary appear subject brother one itself.,2023-06-27,Not Started
7,17,Success when task foreign international main ability.,2023-07-13,On Going
82,113,Send keep from stuff upon time.,2023-06-28,On Going
22,206,Still especially rule usually church check.,2023-07-06,On Going
87,51,Feel stuff baby bank its political summer.,2023-06-18,Not Started
20,206,Only quite total despite top find mention win.,2023-06-20,Not Started
63,38,They administration area stay.,2023-07-03,On Going
25,150,Board final finish eat inside.,2023-06-19,Not Started
46,172,Entire threat billion want major season theory.,2023-06-19,Completed
67,68,Support relate glass significant truth machine citizen.,2023-06-17,Not Started
14,73,Light set woman state consider could street surface.,2023-06-28,Completed
57,18,Population according hot activity deal.,2023-06-17,Not Started
78,218,Letter audience imagine economy.,2023-06-30,Completed
51,80,Quite man field movement model.,2023-07-14,On Going
30,2,Walk law activity official.,2023-07-12,Completed
24,183,Call politics health here film sister along.,2023-07-08,Not Started
85,32,On yet hear property during.,2023-07-03,Completed
88,25,Game research that model campaign while help.,2023-06-24,On Going
83,47,Eat year degree successful sister.,2023-06-19,Not Started
6,143,This share water fine road section area.,2023-07-09,Not Started
