user_id,meeting_response_id,description,due_date,status
24,212,Leave south unit world claim show interest.,2023-07-14,Not Started
10,16,Media drop to moment.,2023-07-05,Not Started
43,56,Miss read oil your car away then man.,2023-07-12,On Going
49,59,Always hot article book north front save.,2023-06-23,Not Started
83,42,Above much ten study less wonder.,2023-06-28,Completed
73,146,While usually international soldier respond certainly wish beautiful.,2023-06-26,On Going
23,182,Since part base identify listen particular.,2023-06-23,Not Started
23,32,Him allow force yeah personal four new.,2023-06-17,Completed
3,143,Top standard traditional candidate my.,2023-06-26,On Going
23,201,We people professional certainly early.,2023-07-01,Completed
2,65,Prove example start amount TV myself.,2023-07-13,Not Started
75,81,Myself mission peace probably under.,2023-07-08,On Going
56,21,Every southern party.,2023-07-06,Completed
9,124,Without off site can response gas character me.,2023-06-16,Completed
77,53,Cost need mention close.,2023-06-24,On Going
86,156,Point arrive idea affect writer tonight.,2023-07-11,On Going
12,12,Life physical describe right them seven.,2023-06-27,Completed
20,224,Head attorney various indicate know six.,2023-07-11,Completed
4,222,Performance significant audience audience political.,2023-07-10,Completed
3,50,Still bill course consumer.,2023-07-04,On Going
2,33,Many soldier laugh even now director figure.,2023-06-19,On Going
40,73,Seat simple body number all election president.,2023-07-05,Completed
62,75,Father focus husband something.,2023-06-30,On Going
29,92,Two take four.,2023-06-28,Completed
24,22,Day north very have section case.,2023-06-30,On Going
54,141,Personal might far.,2023-06-18,On Going
56,220,Know animal mission market.,2023-06-25,Not Started
25,193,Young south stuff street.,2023-07-08,Completed
53,8,Student wall data.,2023-06-22,On Going
9,59,Probably method certain center.,2023-07-02,On Going
26,224,He share nation while size.,2023-06-16,On Going
58,202,Movement when stock college report natural possible.,2023-07-02,On Going
53,211,Continue wrong staff.,2023-07-05,On Going
73,55,Development part young.,2023-06-18,Not Started
65,43,Effort time over campaign decision never woman.,2023-07-14,On Going
18,63,Provide explain choose set hit cut field.,2023-06-28,Completed
82,187,Vote consider son reveal.,2023-06-23,On Going
68,151,Modern improve general dog.,2023-06-23,On Going
73,155,Dark open always bad home discover economic.,2023-07-02,Not Started
67,82,Hundred top who blood.,2023-06-16,Not Started
86,84,Write company ball with however responsibility.,2023-06-21,On Going
72,125,Data style focus son nor sound continue talk.,2023-07-05,On Going
89,59,Class those southern fund choose reflect.,2023-06-22,On Going
71,103,No into young seven consider.,2023-06-23,On Going
3,102,Modern road available the level film direction.,2023-07-12,Not Started
19,223,Director hard executive.,2023-06-17,On Going
95,121,Weight player staff.,2023-07-04,Not Started
58,43,Time sell let feel arm.,2023-07-14,On Going
88,220,Eight policy next example sit grow.,2023-07-07,Not Started
26,65,Out condition whose good second.,2023-06-17,Not Started
75,201,Likely role conference trade none age.,2023-07-14,On Going
