title,description,school_id,owner_id,member_id_list
Higher education careers adviser,Rise while wear almost item within.,1,1,"[21, 95, 88, 57, 91, 100]"
Fish farm manager,Inside various shake statement marriage.,2,2,"[96, 85, 50, 63, 44, 31]"
Microbiologist,Get you play feel discover.,2,3,"[34, 71, 47, 51, 12, 24]"
Computer games developer,Hour order kitchen order me federal worker civil.,2,4,"[5, 56, 64, 83, 22, 73]"
Fisheries officer,Owner family administration alone he weight.,2,5,"[109, 37, 18, 35, 44, 92]"
"Engineer, civil (consulting)",Her check sport study Mr somebody value.,3,6,"[12, 78, 111, 29, 59, 38]"
Geophysicist/field seismologist,Successful simple bank spend call evidence behind everything.,2,7,"[58, 26, 46, 30, 53, 39]"
Communications engineer,Tough country ball hope policy someone thought.,3,8,"[48, 50, 52, 54, 106, 35]"
"Engineer, agricultural",Billion understand section happy money.,3,9,"[4, 33, 92, 56, 62, 55]"
Sports development officer,Perhaps drop network goal.,2,10,"[45, 56, 25, 23, 4, 101]"
"Surveyor, rural practice",Probably term outside again.,1,11,"[31, 108, 94, 49, 66, 47]"
Marine scientist,Value car go.,3,12,"[21, 69, 65, 71, 34, 51]"
Armed forces training and education officer,Skin their room police these support.,1,13,"[59, 57, 89, 51, 111, 87]"
Civil Service fast streamer,Key wrong throughout live.,1,14,"[3, 28, 82, 104, 66, 21]"
Museum education officer,Money soon down check travel throw lay simply.,3,15,"[111, 25, 103, 89, 40, 82]"
"Education officer, community",Note want memory left contain.,3,16,"[70, 28, 46, 14, 57, 13]"
