meetingResponseId,user_id,name,description,on_track_flag
59,27,Political,Not note no.,False
105,6,Play,Single data mean home walk series great sound.,True
196,16,Several,Seem word thousand race measure former to.,True
177,47,Against,Magazine case environment where college collection.,True
30,50,Skill,Before mention democratic within movie.,False
139,45,Here,Fact newspaper most interest drive.,False
170,106,Interest,Begin draw including director.,False
64,10,Form,National attention bed instead law war president.,False
170,88,Spend,Which food evidence.,False
117,4,Person,Cold cause number clear use three ability.,False
169,42,Point,Since first feel offer office city.,False
3,33,Start,Six wind lose be.,True
63,52,Same,Floor have yourself right.,True
188,5,These,Girl still arrive follow laugh sport for.,False
28,43,Gun,Nature able feeling short.,True
5,69,His,Night rise walk a.,False
106,94,Like,Goal between policy.,True
62,8,Important,Across true under myself series understand probably.,True
148,89,Author,Whom baby activity under professional article.,False
121,47,Significant,Various call she make certain leader.,True
131,88,Although,Agreement one him.,False
143,43,Husband,Positive each nature beyond build something in.,True
73,17,Notice,Line argue television evidence bed will follow.,False
120,11,Region,Range appear world now music during three time.,True
43,6,Great,Country authority level month top camera impact approach.,False
134,44,None,No our now technology term painting pattern.,True
166,69,Air,Rest name green bag oil agency.,False
76,47,Character,So agreement why interview how story.,False
182,78,Say,Leave discover establish government choice.,False
55,3,Reveal,Positive politics card rule.,False
182,35,Fire,Wide moment black type.,False
160,57,Decade,Wife sign program.,False
34,50,Particularly,Difference all debate later pay kind.,True
178,84,Herself,Seem about himself situation back edge physical that.,True
44,42,Ready,It assume likely stop probably.,True
27,93,Employee,Make boy old kitchen.,False
194,83,Perhaps,Ahead protect offer site evidence election.,True
109,67,Themselves,Development social pick class even politics data we.,False
92,30,Decade,Attention avoid pattern chance century interest.,True
215,95,Hear,Nature capital rise real peace section glass.,True
124,108,We,Under spring capital soon modern each.,False
52,89,Clear,Day onto though know.,False
51,105,Consumer,Add draw degree same out over close.,True
185,55,Effect,Figure recognize whole various old surface.,False
75,49,Drug,Benefit capital significant human training course.,False
134,61,Remain,Serve feel must receive memory occur.,False
12,23,Commercial,Popular pick why low fill party hand.,True
215,49,Certainly,Pm partner party mind party commercial.,True
6,55,Major,Paper news challenge accept politics.,True
103,103,Pretty,Than approach consider animal smile hundred.,True
198,85,Generation,Site present foreign necessary admit painting than.,True
131,36,Try,Travel scene especially discussion different well.,False
115,55,Experience,Affect win way it.,False
52,2,Tell,Soon best interest husband teacher.,False
30,77,Chair,Behavior as past.,False
221,77,Within,Number into suddenly agent realize general growth purpose.,False
134,28,Son,Surface generation Democrat.,False
73,28,Memory,Try allow discussion always market.,True
162,83,Until,Lay born school able.,False
212,108,Course,Court into bed area leader.,True
131,36,Better,Book require several return trial staff.,True
112,29,Exactly,Soon many do weight strong its notice.,False
101,39,Degree,Property community administration whole attention or worry purpose.,False
162,81,Huge,Live ready plan accept stand effect.,False
76,46,Too,Detail explain artist coach wide choose.,False
25,20,Able,Sea worker power ground child compare.,False
13,6,Official,Watch wish movement interest true billion wonder.,True
88,91,Again,Seat boy main sound church option technology.,True
214,8,Happen,Television traditional Mr maintain store.,False
167,105,Movement,Without off happy foot ok whether.,True
7,15,Computer,Sound part at voice provide speak.,False
171,88,Great,Catch avoid career like.,True
179,86,See,Attorney speech call run around million.,False
167,58,Tonight,Dinner suffer less exactly work table keep.,True
79,16,Machine,Magazine eye mention specific.,False
132,100,Coach,Animal leave figure explain.,True
148,85,Wide,Space term animal career manager season natural participant.,False
84,101,Street,Identify those affect town.,True
168,32,Now,International relationship the knowledge west development.,True
193,64,Data,General blue popular industry this.,True
50,36,Ability,Trade property movement.,True
150,91,Look,On sell although something.,True
111,88,Specific,Quickly place any life draw have population.,True
137,25,Including,Star probably at audience teach international.,False
11,72,Expert,With let forward individual letter lawyer expect develop.,False
67,36,Chance,Whose bill member movement thank soldier.,True
39,105,Board,Day out ago another.,True
112,6,Take,Run about door chance conference think.,True
93,24,Today,Believe perhaps join model ok.,False
176,64,Realize,She amount eat Republican tonight body.,True
161,43,Go,Every full travel about could.,False
208,71,Course,Step size build recognize into tonight.,True
181,66,Maintain,Fire special area control such dream wish.,True
86,38,Night,Center green add role girl stock professor.,False
79,49,Successful,Write money you word.,True
163,14,Others,List other me visit whom.,False
215,67,Base,According court throughout your.,True
165,70,General,Feeling stop too hit our.,False
150,6,Bank,Attack under cost require away.,True
51,29,Mission,Range almost memory you.,False
83,71,Term,Play couple trade well act respond.,False
101,35,Share,Care resource mean smile series.,True
218,99,Girl,Determine question fire leg agent wide.,True
37,20,Bring,Area cover measure although fast.,True
211,68,Write,Language bank president threat loss.,True
86,44,Meeting,Better beat he around hair just commercial.,False
24,70,Responsibility,Color guess generation general visit bank push.,False
219,76,Source,East late fish thank.,False
45,87,Continue,Fire none material side wind white board whom.,False
32,112,Meeting,Above book manager manager table hard dog.,True
92,23,Share,Suddenly attorney owner exactly others generation common.,True
82,68,Improve,Table book claim up.,True
211,22,Peace,Another term actually its sure.,False
84,26,Team,Hundred nor building dog your.,True
187,45,Why,Action at hope alone.,True
50,40,Rich,Respond win serious understand.,False
8,81,Everybody,Lose since difficult development eat.,True
161,28,Wide,Approach group computer.,False
61,51,At,Difficult new space face minute increase.,True
167,29,Less,Site discuss attack reflect half resource.,False
132,31,Parent,Meet enough teacher send.,True
110,2,Ago,Bad difficult argue out.,True
3,36,Win,Head approach campaign wall off song.,True
38,94,Over,Appear key write measure will stock field husband.,False
139,19,What,Community week though say for.,False
108,26,Drive,Someone suddenly season meet.,True
133,15,Policy,New sure more check.,False
99,97,Money,Fight report continue.,True
201,87,Shoulder,Else fact than current official.,True
115,76,Look,Also bad power particular exist enjoy performance.,True
105,58,Worker,Bar develop include plant candidate certainly item.,True
33,56,Activity,Left likely moment create peace although.,True
85,111,Character,Among example statement sound well nice kitchen.,False
148,60,On,Professor back important still.,False
129,59,Why,Shake couple cell response seem party.,True
31,35,Kind,Debate book fact improve later suddenly tough mean.,True
1,58,Join,Forward government mind always accept.,False
30,32,Wide,Democrat guy spring buy car artist foreign.,False
62,67,Organization,Ground be born off education accept recently explain.,False
169,33,Process,Economy bill hot strong his head require.,True
84,90,Friend,Number bill too message.,False
8,82,Mission,Fact easy set onto out step want.,True
151,64,Perhaps,Market without market safe probably.,False
61,18,Rise,Game wind town benefit move financial job.,True
163,46,Civil,Great order practice wife position rock many.,False
192,89,Already,Every fund general send training pretty toward.,False
12,44,Most,Interesting morning simple cut.,True
111,88,Bed,Fish car treatment.,False
30,45,Growth,Hold imagine three modern by election some maybe.,True
216,5,Manage,Future capital music political light themselves.,True
124,92,Attack,Message something blue health.,False
113,26,Life,Article girl seek professional.,True
85,40,Well,Until pattern need hotel opportunity beat.,True
204,65,Worry,Law paper ground mean yeah return.,True
31,50,Since,Again pull nothing report address right.,True
210,33,Almost,Measure establish alone century.,True
128,37,Itself,Pass financial forget him television recent herself plan.,False
86,77,Experience,Member of chair.,False
80,102,Draw,Simply wife study hit way.,True
49,24,Bill,Great ahead unit baby figure general.,False
185,46,Side,Rest cup free soldier population.,False
208,92,Weight,Sometimes and camera television.,False
48,110,Newspaper,Southern white star capital sit head.,False
186,8,Go,Institution interesting personal pattern.,True
89,78,Environment,Wish lead local sea.,False
199,18,Cup,Direction power here police beat security.,False
43,43,Resource,Administration even child difficult who today.,False
29,83,Maintain,Fight stay top seem way.,True
122,8,Compare,Job do gun message truth hour.,False
38,89,Few,Former fear out agree long where education.,False
105,80,Score,Air research public red move trip.,True
147,74,Meet,Adult what month bit risk movement region.,True
30,100,Particular,Vote put serious return.,True
122,109,Soldier,Knowledge west area through defense.,False
159,12,Every,Program majority today model never.,False
172,71,Discover,Possible specific edge occur coach stuff.,False
191,68,Listen,Term kid star soon several run possible.,True
106,97,Offer,Book maintain finish world thousand financial line.,False
12,81,Admit,Successful upon soon television main.,True
130,22,To,Leader get artist often.,True
101,82,Along,Service probably picture teach majority change would its.,False
8,92,Sound,Suggest plant after head raise there particular.,True
75,80,Season,Market project have necessary challenge.,True
26,49,Dinner,Stay few sort skill modern ability.,False
149,16,Young,Mission former sign financial.,False
149,6,Series,Total keep item floor tonight.,True
163,80,Where,Game night discover.,True
5,93,Society,Contain among edge everyone marriage.,True
34,104,Remain,War teacher enjoy her kitchen until model.,True
32,19,Certain,Although international drug see good indicate.,False
39,64,Environment,Trial now buy teach just pick director scientist.,False
168,6,Imagine,Across machine third ten drive with pressure.,False
145,44,Marriage,Condition talk school later child.,False
23,40,Onto,Agreement down long tonight doctor.,True
112,60,Small,Build bed score nice prove return bill.,True
40,37,Live,Thing what consumer religious.,False
29,61,Tree,Property follow learn cup.,True
155,98,Foreign,Interesting raise per information put attack kitchen movie.,False
19,50,Under,Attorney certainly participant city attorney do.,True
18,75,Grow,Writer best company well church grow.,False
105,61,Oil,Carry team international themselves data guy bit.,False
31,49,Economic,Others west board amount consider behind.,False
188,38,Serious,Space wait laugh.,False
173,100,Interesting,Worry concern knowledge player data.,False
161,106,Off,Know off day forward indicate class participant.,False
174,51,Carry,Pass voice while.,False
210,44,Serious,Coach determine cold late indicate meeting indeed.,True
137,67,Sit,Fly write executive head thousand goal.,True
56,6,Sign,Science argue thus each stand buy.,False
34,61,Power,Doctor politics general study safe.,True
202,72,Put,But get yard simply price music.,False
211,10,Coach,Magazine recent nation usually lawyer already direction require.,False
26,112,A,Quickly after still along.,False
164,95,Heavy,Music number similar.,True
24,93,Relationship,Long weight local want pick.,True
30,102,For,What area already ahead pattern.,True
36,54,Often,Step very stock agency way including like.,False
136,25,Another,Your above product meet.,True
153,31,Law,Nation Mrs old now measure leader term.,False
114,23,Road,Recent share themselves act time home trouble.,True
127,49,Skill,Difference project technology assume land.,True
39,99,He,Our phone positive traditional.,False
210,2,Piece,Crime born language board.,False
136,23,Return,Main prepare end close item rule process.,True
122,15,Suffer,Lawyer military responsibility his else star few list.,False
166,17,Social,They travel game group work produce.,False
99,103,Live,Evening film carry all civil realize.,True
110,90,Edge,Well book day.,True
214,86,Food,You be tend enjoy learn husband edge.,True
220,95,Son,Likely continue wait teach.,True
82,97,Them,During shake music onto outside ask.,False
109,10,If,Sea wait itself tree fund hair decide bank.,False
25,91,Bank,Stuff right result begin forward better loss.,True
14,28,Improve,Fine employee worry detail test than.,True
180,93,Likely,Seven just mention again simply receive avoid bring.,True
158,77,Nearly,Table international attack include middle sense trip.,True
100,64,Feeling,Age day red party class.,True
175,60,Thank,Six or rock.,False
214,98,Size,Get least within best.,True
20,30,Stay,Suffer computer community somebody sense.,False
172,22,Probably,Else difficult PM peace more.,False
135,86,Manager,Sit television risk successful different.,True
65,33,Else,Create race best against new can plant these.,False
137,10,Car,Second subject himself very why final.,False
191,79,Write,Hour capital movie control view kid.,False
54,106,Exist,Stage themselves speak vote try.,False
54,47,Answer,Kitchen decide finish new mouth growth night.,False
25,62,Score,Expect store enter write.,True
90,111,Cup,Machine may successful body tax.,False
84,9,Enough,Leg environmental deal pretty administration already five.,True
14,51,Car,Various through management start discussion whether five.,True
99,1,Sell,Wear good just fall act.,False
209,83,Relationship,You edge second pass could age.,True
96,53,Occur,Between around fall least sound her see.,True
119,46,Reduce,Candidate friend practice everybody sense participant step.,False
104,93,Debate,Everything possible still position future protect.,False
162,18,Reach,Peace season investment either way exactly do.,True
5,5,Artist,Coach change election machine clearly organization hard.,True
109,83,Top,Official out picture carry.,False
172,13,Key,Hit language well customer sometimes fall.,True
98,11,Area,Few away break remain.,True
175,96,Give,Fear concern once manage help relate.,True
96,7,Oil,Throw also return begin.,False
4,43,Low,Rather card fact do ten wish under training.,False
183,35,Father,Down guy feel could weight prevent put.,False
189,54,South,Central lot born view.,True
203,105,Glass,Treat apply piece Mr.,True
48,99,Avoid,Young important authority senior.,False
146,77,Join,That share agree.,False
219,58,Themselves,Financial season worry lay forward mean.,False
105,107,Name,Would answer list simply let spring.,True
174,104,Network,Interesting positive suddenly color group.,False
207,100,Very,Enough back ten spring within action eat financial.,True
217,13,Space,Enjoy for hand national.,True
180,32,Gun,Sit win newspaper continue magazine.,False
134,78,Moment,Factor cup dog best education shake group pull.,True
114,99,Should,Record bed apply get fall represent after.,False
59,41,City,Senior generation down maintain fast.,False
223,17,For,Perhaps reality fire term admit table.,True
37,109,Then,Space drive difficult perform activity.,False
120,82,Fish,Some executive safe.,False
70,72,Resource,Poor market young open former.,False
92,79,Have,Yeah week ago child.,True
8,30,Possible,Sister brother billion science draw such.,False
43,46,Race,Represent visit election guess medical.,False
72,75,Hotel,Them memory stand marriage check until.,False
34,86,Such,Sea car international team step exist TV.,False
172,6,Whether,Number popular collection year.,True
82,37,Focus,Leg machine purpose.,False
1,43,Consumer,Section present remember enough know.,False
151,58,Coach,Oil water your impact.,False
18,93,Answer,Far treat again garden benefit environment second.,False
107,73,Law,Shoulder discuss Republican can up because white building.,True
123,100,Statement,Take window eight respond use.,True
74,43,Manage,Another organization realize technology.,True
84,37,Character,Charge human matter quite travel every more.,True
21,87,Oil,Remain read you leader always season hot happy.,False
134,91,System,Travel more event citizen.,False
168,58,Spring,Water technology our trial deal service movement.,False
205,20,Control,Trip common wrong player.,True
139,51,Short,Even where attack pattern size clear brother there.,False
37,87,Care,Hot occur hard material peace population.,True
48,91,Participant,Long energy behavior seem process stock.,False
81,46,Feel,Military peace certain nice maintain.,True
180,73,Tv,Coach above common science.,False
85,47,Article,Notice other almost care enough east moment.,False
147,96,Fall,Member now fear beat best after baby.,True
97,89,Subject,Customer against beyond finally boy establish white.,False
209,14,None,My writer night quite stuff.,False
120,48,Space,Gas east wide sister forget main challenge serve.,True
123,93,Eye,Lawyer if raise upon really white.,True
113,112,Full,As action reveal itself several step drive.,False
95,39,Effort,Answer learn only compare.,False
178,102,Hospital,East think attorney something official American.,False
131,40,Wonder,Probably or leader fall authority.,True
55,49,Build,Once identify daughter available happen best remember.,False
123,22,Natural,Ground season quickly particular factor able road employee.,False
217,19,Concern,One history necessary exactly.,False
200,30,Song,Base now and sister must.,True
7,57,Field,Hit board science produce particular.,False
24,79,Group,Hot also wear remember message financial set.,False
20,91,Rate,Ability magazine discussion would though.,True
166,78,Factor,Strong our himself move guy opportunity.,False
220,99,Without,News trouble office always hour box over movie.,False
105,96,Despite,That with bar modern data.,False
37,47,Its,About why environment.,False
99,20,Group,Amount crime reduce listen building success.,False
142,82,Treat,Him occur write might democratic.,False
62,60,Meeting,Audience charge at word wear role worry.,False
112,102,Exactly,Trip paper produce operation argue magazine smile skill.,False
156,19,Reason,Involve control save number.,True
102,73,Development,Attention step exactly skill could think during.,False
80,89,Article,Traditional kind artist compare plant school over.,True
61,63,Commercial,Drop who three movie option along simply.,True
45,19,Information,Between opportunity decide seek decade.,True
71,66,Hand,Require week boy.,True
50,104,Father,Catch else today collection able same media.,True
147,90,Person,Military spend suffer.,True
114,21,Common,Energy glass part billion baby order daughter.,True
164,110,Similar,Inside language compare director.,False
173,93,Whatever,Fund Mr for.,False
91,98,Stay,Six land former require popular policy.,False
101,104,Those,Partner brother sign find.,False
209,17,Of,Where audience player.,True
164,106,Us,Around growth at sit.,True
32,56,Character,Customer perform model hard talk.,False
39,11,Process,Speak artist nature drive report.,False
192,39,Those,Ability quite option perform certain can.,False
152,63,Better,Wide per middle ever else change.,False
76,83,Eight,Nor life wait thank bit decade.,True
206,57,Music,Than Mrs describe produce.,True
139,51,Really,Cup force answer five staff get important.,True
117,13,Behind,Manager reason nation here.,False
164,12,Trade,Own forget when others late position.,True
11,65,Trial,Box teacher lead check.,True
87,73,See,Congress whether case cover than.,True
139,22,Night,Born let term fly could.,True
38,102,Nor,Wind American image number career bar.,False
116,98,No,Statement back cut system American send.,True
204,33,Stock,North now read this smile during.,True
81,111,City,Employee environmental operation real impact.,True
2,60,Matter,Support lay hear available.,False
49,14,Face,Wish because particular ten mean drug view.,True
22,103,Why,Half move tough argue bit.,False
155,35,Assume,Market ball bar should environmental forget consumer feeling.,True
7,105,Loss,Off simply whom.,True
160,106,These,Seem finally parent people.,True
13,111,Name,Student focus political woman really.,True
24,107,Way,Fast fire either probably democratic hope.,True
138,43,Director,Course two technology possible tough enough.,True
29,30,Heart,Size course whom deep.,True
26,39,Deal,Drug need newspaper itself occur.,False
212,55,Law,Realize newspaper about different national.,False
129,62,Analysis,Practice a property listen you.,True
115,33,Room,Fire food far.,False
77,112,Financial,Majority address season reveal.,False
223,27,Writer,Surface like computer project artist evidence.,False
174,111,Goal,Step machine yeah or realize phone.,True
38,17,You,Score believe rise increase now same.,True
135,70,Industry,Medical truth president enough.,True
39,90,Old,Same affect knowledge without there listen government.,True
59,90,Knowledge,Western good its answer.,False
156,15,Note,Suggest parent cultural.,True
143,92,Model,Network animal oil.,True
149,28,Wide,Significant human individual half yet body teach.,True
161,50,Thought,Director little finish just remember also.,True
140,87,Service,Off federal sign degree media body probably drive.,False
119,73,Surface,Six those course sort store.,False
206,64,Speak,Record newspaper most local with.,False
16,18,Themselves,Short real type provide election how.,True
140,84,World,Particular area meeting.,False
169,52,Glass,Course environmental tax firm interest produce.,False
216,88,Perhaps,Care PM argue whose difference herself room.,True
36,17,Receive,Red hope garden by tax two marriage close.,True
223,65,Owner,These determine technology performance such chance section.,False
152,81,Across,Job sell chair various method executive color.,True
109,67,Lose,Force she less other.,True
53,18,Purpose,Administration politics dog try thousand yard.,False
193,70,College,Something group win any factor everything artist.,True
138,107,Visit,Wrong work even quality maintain impact.,True
1,94,Glass,Hotel war part wrong.,False
206,43,Who,Hand attack age.,True
28,3,Prevent,Business interesting court another between six student sense.,False
58,11,Staff,Court arm suggest kitchen number.,False
36,97,There,Reveal beat buy suggest author.,True
154,40,Well,Painting great friend.,True
222,15,See,Perform affect apply second.,True
125,106,Site,Customer main story opportunity.,True
95,72,Company,Interview win pattern stay model whether.,False
163,2,Hair,Blood all power together nothing campaign wear.,True
198,75,Machine,Number fish trial listen religious everybody drop.,True
25,18,Several,Most fast more eat opportunity.,False
9,11,Color,Environment couple sometimes study west analysis clear.,False
209,40,Both,Including material anything almost arm.,True
128,31,Sport,Eight film interest environment shake to.,True
22,108,Cut,Prove between glass trade media north prove language.,False
35,53,Huge,Likely will follow.,True
36,106,Name,Drive life accept need capital.,True
220,48,Talk,Within group alone deal marriage table yet.,True
212,37,Hit,Lead poor cover place.,True
188,20,Candidate,Part picture environment responsibility western.,True
50,81,Truth,Network those still believe sort wish pick.,True
53,99,Also,Exactly discuss minute.,False
128,70,Network,Issue none ready factor.,False
70,68,Figure,Suddenly expert respond rich weight.,True
65,98,Option,Final newspaper toward guy piece sport increase coach.,True
165,48,Letter,Available color majority trouble.,False
156,11,Account,Fill many itself mean section.,True
219,11,Property,Book adult general event argue.,False
33,93,Past,Already drop friend himself.,False
51,44,Structure,Threat debate data specific growth.,False
16,37,Good,Four politics admit two indeed necessary.,False
186,19,Yeah,Always it toward prepare main.,False
153,107,Forget,Then model guess me former new.,False
95,105,Every,Something job resource focus skill safe.,True
12,55,Mrs,Concern left dinner company street.,True
100,9,To,Level wrong board actually we.,True
116,35,General,Quite door early lay blue image while.,False
64,7,Purpose,Peace consider pay significant.,False
42,105,Who,For mention fall including.,True
217,86,Population,Owner bar lay mission question soldier.,False
61,57,Guess,Field allow traditional wall bank style.,True
54,5,Glass,Price know than maybe single.,False
98,76,Child,Fly end soon economic.,False
95,8,Relationship,Scientist give themselves center food particular.,False
92,14,Every,Score not media different my.,False
96,62,Lay,Marriage bring determine why wall.,False
36,103,Most,Remain he public investment.,False
